{
  "schema_version": 1,
  "repository": "doylenehemiah6893-afk/Macro_menu",
  "branch": "codex/dev-review-report",
  "evidence_commit": "68022541bf8cacd1db012128daf4cdef1048af8d",
  "evidence_tree": "405f24751ddabecced9b547680e6dbdefdeb80be",
  "delivery_parent_commit": "68022541bf8cacd1db012128daf4cdef1048af8d",
  "approved_cutoff": "abce8ffe37d25cc8f189ae9e9a2a1e942279a5ad",
  "intake_record_path": "catvba_refactor/intake/records/2026-07-13-initial-baseline.json",
  "intake_record_digest": "ee1405f0e24573566126fabeb1f5a5fdf2b5541082733f9171b54c94c35a9f19",
  "python_requirement": "CPython 3.12",
  "uv_requirement": "uv 0.9.25",
  "lock_digest": "d52656bec3aa50218f22df7a02f16dd0b9e7868ad0c51b8d22959109e694e177",
  "gate_statuses": {
    "G0": "PASS",
    "G1": "PASS",
    "G2": "BLOCKED",
    "G3": "BLOCKED",
    "G4": "BLOCKED",
    "G5": "BLOCKED",
    "G6": "BLOCKED",
    "G7": "BLOCKED"
  },
  "active_bundle_path": "artifacts/b28-discovery/bundles/bundle-ab5205f4f37e8ec467a9800a",
  "bundle_digest": "ab5205f4f37e8ec467a9800afb986bc2290ae7235820d38423cfde2b7c89d895",
  "active_kit_id": "kit-e93a2e7f48c3f4d2f179",
  "kit_zip_digest": "d763b3e1a1a2e33d994a5c030e0fa3b541e8a46648f11378870c6a86711cf012",
  "active_handoff_id": "handoff-b8d9d535604e78551423",
  "handoff_digest": "6d889446c62e0de338e6469784166f4d72dd3144618969a2b286748e10e44192",
  "expiry": "2026-07-23T11:11:06Z",
  "revocation_status": "active",
  "last_full_test_count": 1659,
  "last_reproducibility_receipt": "artifacts/b28-discovery/bundles/bundle-ab5205f4f37e8ec467a9800a/receipts/build-reproducibility.json",
  "release_eligible": false,
  "next_action": "run-b28-discovery"
}
